{
  "schema_version": 1,
  "timestamp": "2025-10-03T16:39:32Z",
  "repo_path": "/Users/djh/work/src/github.com_local/djh00t/kcmt",
  "params": {
    "limit": 5,
    "timeout": null
  },
  "results": [
    {
      "provider": "openai",
      "model": "gpt-5-codex",
      "avg_latency_ms": 3519.235583,
      "avg_cost_usd": 0.000083,
      "quality": 0.0,
      "success_rate": 0.0,
      "runs": 5
    },
    {
      "provider": "openai",
      "model": "gpt-4.1",
      "avg_latency_ms": 2186.463942,
      "avg_cost_usd": 0.000124,
      "quality": 0.0,
      "success_rate": 0.0,
      "runs": 5
    },
    {
      "provider": "openai",
      "model": "gpt-4.1-mini",
      "avg_latency_ms": 1949.320575,
      "avg_cost_usd": 0.000025,
      "quality": 0.0,
      "success_rate": 0.0,
      "runs": 5
    },
    {
      "provider": "openai",
      "model": "gpt-4.1-nano",
      "avg_latency_ms": 2125.081925,
      "avg_cost_usd": 0.000006,
      "quality": 0.0,
      "success_rate": 0.0,
      "runs": 5
    },
    {
      "provider": "openai",
      "model": "gpt-5-chat-latest",
      "avg_latency_ms": 2025.0851,
      "avg_cost_usd": 0.000083,
      "quality": 0.0,
      "success_rate": 0.0,
      "runs": 5
    },
    {
      "provider": "anthropic",
      "model": "claude-sonnet-4-5-20250929",
      "avg_latency_ms": 536.004667,
      "avg_cost_usd": 0.00019,
      "quality": 0.0,
      "success_rate": 0.0,
      "runs": 5
    },
    {
      "provider": "anthropic",
      "model": "claude-sonnet-4-20250514",
      "avg_latency_ms": 359.528483,
      "avg_cost_usd": 0.00019,
      "quality": 0.0,
      "success_rate": 0.0,
      "runs": 5
    },
    {
      "provider": "anthropic",
      "model": "claude-3-7-sonnet-20250219",
      "avg_latency_ms": 408.653842,
      "avg_cost_usd": 0.00019,
      "quality": 0.0,
      "success_rate": 0.0,
      "runs": 5
    },
    {
      "provider": "anthropic",
      "model": "claude-3-5-haiku-20241022",
      "avg_latency_ms": 413.721933,
      "avg_cost_usd": 0.000051,
      "quality": 0.0,
      "success_rate": 0.0,
      "runs": 5
    },
    {
      "provider": "xai",
      "model": "grok-3",
      "avg_latency_ms": 1969.326675,
      "avg_cost_usd": 0.000499,
      "quality": 55.4,
      "success_rate": 1.0,
      "runs": 5
    },
    {
      "provider": "xai",
      "model": "grok-3-mini",
      "avg_latency_ms": 5474.43605,
      "avg_cost_usd": 0.00003,
      "quality": 51.8,
      "success_rate": 1.0,
      "runs": 5
    },
    {
      "provider": "xai",
      "model": "grok-4-0709",
      "avg_latency_ms": 20692.699717,
      "avg_cost_usd": 0.000439,
      "quality": 45.4,
      "success_rate": 0.8,
      "runs": 5
    },
    {
      "provider": "xai",
      "model": "grok-code-fast-1",
      "avg_latency_ms": 3528.313775,
      "avg_cost_usd": 0.000055,
      "quality": 56.2,
      "success_rate": 1.0,
      "runs": 5
    }
  ]
}